<?xml version="1.0"?>
<!DOCTYPE vortaro SYSTEM "../dtd/vokoxml.dtd">

<vortaro>
<art mrk="$Id: entomolog.xml,v 1.2 2010/04/27 16:30:57 revo Exp $">
<kap>
  <ofc>7</ofc>
  <rad>entomolog</rad>/o <fnt><bib>PIV2</bib></fnt>
</kap>
<drv mrk="entomolog.0o">
  <kap><tld/>o</kap>
  <snc>
    <ref tip="dif" cel="entomo.0isto">entomologiisto</ref>
  </snc>
  <trd lng="en">entomologist</trd>
  <trd lng="pl">entomolog</trd>
</drv>
</art>

<!--
$Log: entomolog.xml,v $
Revision 1.2  2010/04/27 16:30:57  revo
Sebastian Cyprych: +trd pl

Revision 1.1  2010/04/24 17:07:15  revo
Russ Williams: nova artikolo

-->
</vortaro>
