<?xml version="1.0"?>
<!DOCTYPE vortaro SYSTEM "../dtd/vokoxml.dtd">

<vortaro>
<art mrk="$Id: muzikolog.xml,v 1.3 2009/08/13 16:30:38 revo Exp $">
<kap>
  <rad>muzikolog</rad>/o
</kap>
<drv mrk="muzikolog.0o">
  <kap><tld/>o</kap>
  <snc mrk="muzikolog.0o.MUZ">
    <uzo tip="fak">MUZ</uzo>
    <ref tip="dif" cel="muzik.0osciencisto.MUZ">muzikosciencisto</ref>
    <ekz>
      la <tld/>oj ne havas grandajn malfacila&jcirc;ojn komparante
      melodiojn, kiujn &ccirc;iam oni skribas per la sama skribsistemo
      <fnt>
      <aut>F. Hoerburger</aut>,
      <vrk><url
      ref="http://donh.best.vwh.net/Esperanto/Literaturo/Revuoj/np/np5802/kinetografio.html">
      Kinetografio kaj dancesploro</url></vrk>,
      <lok>Norda Prismo 1958:02, p. 81-83a</lok>
      </fnt>.
    </ekz>
  </snc>
  <trd lng="bg">&c_m;&c_u;&c_z;&c_i;&c_k;&c_o;&c_l;&c_o;&c_g;</trd>
  <trd lng="fr">musicologue</trd>
  <trd lng="it">musicologo</trd>
  <trd lng="nl">musicoloog</trd>
</drv>
</art>

<!--
$Log: muzikolog.xml,v $
Revision 1.3  2009/08/13 16:30:38  revo
Wieland Pusch: +trd bg

Revision 1.2  2009/08/11 16:31:30  revo
Paul Peeraerts: +trd nl

Revision 1.1  2007/03/24 17:30:32  revo
Jeromo Vasxe: nova artikolo

-->
</vortaro>
