<?xml version="1.0"?>
<!DOCTYPE vortaro SYSTEM "../dtd/vokoxml.dtd">

<vortaro>
<art mrk="$Id: kartunkin.xml,v 1.1 2008/08/29 16:30:28 revo Exp $">
<kap>
<rad>kartunkin</rad>/o
</kap>
<drv mrk="kartunkin.0o">
  <kap><tld/>o</kap>
  <snc>
  <uzo tip="fak">KIN</uzo>
    <dif>
<ref tip="vid" cel="kin.0o.KIN.arto">Kino</ref> pere de desegna&jcirc;oj.
    </dif>
  </snc>
<trd lng="it">cinema d'animazione</trd>
</drv>
</art>

<!--
$Log: kartunkin.xml,v $
Revision 1.1  2008/08/29 16:30:28  revo
Antonio Codazzi: nova artikolo

-->
</vortaro>