<?xml version="1.0"?>
<!DOCTYPE vortaro SYSTEM "../dtd/vokoxml.dtd">

<vortaro>
<art mrk="$Id: artrit1.xml,v 1.3 1999/10/06 08:58:16 revo Exp $">
<kap>
<rad>artritism</rad>/o
</kap>
<drv mrk="artrit1.0o">
<kap><tld/>o</kap>
<uzo tip="fak">MED</uzo>
<snc>
<dif>
artritema temperamento.  
</dif>
</snc>
</drv>
</art></vortaro>
