<?xml version="1.0"?>
<!DOCTYPE vortaro SYSTEM "../dtd/vokoxml.dtd">

<vortaro>
<art mrk="$Id: principe.xml,v 1.3 2009/10/28 17:30:44 revo Exp $">
<kap>
  <rad>principe</rad>/o
</kap>

<drv mrk="principe.0o">
  <kap>
    <tld lit="P"/>o
    <fnt>
      <vrk>Oficiala Informo de AdE</vrk>,
      <lok>numero 12</lok>
    </fnt>
  </kap>
  <snc mrk="principe.0o.GEOG">
    <uzo tip="fak">GEOG</uzo>
    <dif>
      <ref tip="vid" cel="atlant.0o.GEOG">Atlantika</ref> 
      (Gvinea Golfo) insulo, konsitiganta kun <ref tip="vid" 
      cel="santome.0o.GEOG">Santomeo</ref>
      &scirc;taton <ref tip="malprt"
      cel="santome.0oprincipeo.sxtato">Santomeo kaj Principeo</ref>.
      Situo: 1&ring;37&#8242;N 7&ring;24&#8242;E.
    </dif>
    <trd lng="bg">&c_P;&c_r;&c_i;&c_n;&c_s;&c_i;&c_p;&c_i;</trd>
    <trd lng="de">Pr&iacute;ncipe</trd>
    <trd lng="en">Pr&iacute;ncipe</trd>
    <trd lng="nl">Principe</trd>
    <trdgrp lng="pl">
      <trd>Wyspa Ksi&aogonek;&zdot;eca</trd>
    </trdgrp>
  </snc>
</drv>

</art>

<!--
$Log: principe.xml,v $
Revision 1.3  2009/10/28 17:30:44  revo
Paul Peeraerts: +nl

Revision 1.2  2009/05/19 17:00:33  revo
Wieland Pusch: +trd bg,de

Revision 1.1  2009/05/18 16:30:36  revo
Sebastian Cyprych: nova artikolo

-->
</vortaro>
