<?xml version="1.0"?>
<!DOCTYPE vortaro SYSTEM "../dtd/vokoxml.dtd">

<vortaro>
<art mrk="$Id: gratif1.xml,v 1.5 2001/10/15 18:17:39 revo Exp $">
<kap>
<rad>gratifikaci</rad>/o
<fnt>Z</fnt>
</kap>
<drv mrk="gratif1.0o">
<kap><tld/>o</kap>
<uzo tip="fak">EKON</uzo>
<uzo tip="stl">ARK</uzo>
<fnt><bib>PV</bib></fnt>
<snc>
<ref tip="dif" cel="gratif.0o">gratif(ik)o.</ref>
</snc>
</drv>
</art>
<!--
$Log: gratif1.xml,v $
Revision 1.5  2001/10/15 18:17:39  revo
Marc Bavant: sxovis ref ekster dif, kor ref cel, +uzo ARK, +fnt

Revision 1.4  2001/05/29 18:14:31  revo
Ulrich Fellmann: + uzo EKON

-->
</vortaro>
