<?xml version="1.0"?>
<!DOCTYPE vortaro SYSTEM "../dtd/vokoxml.dtd">

<vortaro>
<art mrk="$Id: vaux.xml,v 1.2 2009/09/26 16:32:25 revo Exp $">
<kap>
<rad>va&ubreve;</rad>
</kap>
<drv mrk="vaux.0">
  <kap><tld/></kap>
  <gra><vspec>sonimito</vspec></gra>
  <snc>
    <dif>
      Sono de hunda bleko. <ekz><tld/>-<tld/></ekz>
    </dif>
  </snc>
  <trd lng="hu">vau</trd>
</drv>
</art>

<!--
$Log: vaux.xml,v $
Revision 1.2  2009/09/26 16:32:25  revo
Jozefo Horvath: + trd hu

Revision 1.1  2008/08/25 18:15:41  revo
Antonio Codazzi: nova artikolo

-->
</vortaro>
