<?xml version="1.0"?>
<!DOCTYPE vortaro SYSTEM "../dtd/vokoxml.dtd">

<vortaro>
<art mrk="$Id: ekzokrin.xml,v 1.2 2007/06/27 16:31:03 revo Exp $">
<kap>
  <rad>ekzokrin</rad>/a <fnt><bib>NePiv</bib></fnt>
</kap>
<drv mrk="ekzokrin.0a">
  <kap><tld/>a</kap>
  <uzo tip="stl">RAR</uzo>
  <snc mrk="ekzokrin.0a.FIZL">
    <uzo tip="fak">FIZL</uzo>
      <ref tip="dif" cel="dukt.0a.FIZL">dukta</ref>
      <ekz>
        biologie, haroj kaj similaj fenomenoj estas nur sekrecioj de 
        <tld/>aj glandoj, fari&gcirc;intaj sufi&ccirc;e solidaj, por resti a&ubreve; kiel 
        flekseblaj haroj, a&ubreve; kiel pli solida skvamo, &scirc;elo, ungo, hufo
        <fnt>
          <aut>E. Pauli</aut>,
          <vrk><url ref="http://www.cfh.ufsc.br/~simpozio/">Enciklopedio 
          simpozio</url></vrk>,
          <lok>artikolo &leftquot;haro&rightquot;, 1996-05</lok>
        </fnt>.
      </ekz>
  </snc>
  <trd lng="pt">ex&#243;crino</trd>
</drv>
</art>

<!--
$Log: ekzokrin.xml,v $
Revision 1.2  2007/06/27 16:31:03  revo
Tulio Flores: +tr pt

Revision 1.1  2006/12/21 17:30:25  revo
Jeromo Vasxe: nova artikolo

-->
</vortaro>
