<?xml version="1.0"?>
<!DOCTYPE vortaro SYSTEM "../dtd/vokoxml.dtd">

<vortaro>
<art mrk="$Id: lotos.xml,v 1.4 2009/10/08 16:31:30 revo Exp $">
<kap>
<rad>lotos</rad>/o
</kap>
<drv mrk="lotos.0o">
<kap><tld/>o</kap>
<snc>
<dif><ref tip="dif" cel="lotus.0o.arbo">Lotuso</ref>
</dif>
</snc>
<trd lng="nl">lotusboom</trd>
</drv>
</art>
<!--
$Log: lotos.xml,v $
Revision 1.4  2009/10/08 16:31:30  revo
Paul Peeraerts: +nl +ref

-->
</vortaro>
