<?xml version="1.0"?>
<!DOCTYPE vortaro SYSTEM "../dtd/vokoxml.dtd">

<vortaro>
<art mrk="$Id: konver1.xml,v 1.4 2006/11/18 17:30:26 revo Exp $">
<kap>
<rad>konvers</rad>/i
</kap>
<drv mrk="konver1.0i">
<kap><tld/>i</kap>
<gra><vspec>tr</vspec></gra>
<uzo tip="fak">EKON</uzo>
<snc>
<dif>
&Scirc;an&gcirc;i publikan valorpaperon  je la sama malpli rentumita.  
</dif>
  <trd lng="pt">converter <klr tip="amb">(fin.)</klr></trd>
</snc>
</drv>
</art>
<!--
$Log: konver1.xml,v $
Revision 1.4  2006/11/18 17:30:26  revo
Tulio Flores: +tr pt

-->
</vortaro>

