<?xml version="1.0"?>
<!DOCTYPE vortaro SYSTEM "../dtd/vokoxml.dtd">

<vortaro>
<art mrk="$Id: simeon.xml,v 1.2 2009/10/12 16:30:48 revo Exp $">
<kap>
  <rad>Simeon</rad>/o <fnt><bib>PIV2</bib></fnt>
</kap>
<drv mrk="simeon.0o">
  <kap><tld/>o, <var><kap><tld/></kap></var></kap>
  <snc mrk="simeon.0o.NOM">
    <uzo tip="fak">NOM</uzo>
    <dif>
      Vira anta&ubreve;nomo hebredevena:
      <ekz>
        en Jerusalem estis viro, kies nomo estis <tld/>, kaj &ccirc;i tiu
        estis
        justa kaj pia
        <fnt><bib>NT</bib>, <lok>&amp;Luk 2:25</lok></fnt>.
      </ekz>
    </dif>
  </snc>
  <trd lng="fr">Sim&eacute;on</trd>
  <trd lng="it">Simeone</trd>
</drv>
</art>

<!--
$Log: simeon.xml,v $
Revision 1.2  2009/10/12 16:30:48  revo
Antonio Codazzi: +trd it

Revision 1.1  2005/08/13 16:32:25  revo
Jeromo Vasxe: nova artikolo

-->
</vortaro>
