<?xml version="1.0"?>
<!DOCTYPE vortaro SYSTEM "../dtd/vokoxml.dtd">

<vortaro>
<art mrk="$Id: empiri1.xml,v 1.6 2005/07/27 16:31:40 revo Exp $">
  <kap>
    <rad>empirism</rad>/o
    <fnt>Z</fnt>
  </kap>
  <drv mrk="empiri1.0o">
    <kap><tld/>o</kap>
    <snc>
      <dif>
        <ref tip="dif" cel="empiri.0ismo">empiriismo</ref>.  
      </dif>
    </snc>
    <trd lng="be">&c_e;&c_m;&c_p;&c_ib;&c_r;&c_y;&c_z;&c_m;</trd>
    <trd lng="hu">empirizmus</trd>    
    <trd lng="ru">&c_e;&c_m;&c_p;&c_i;&c_r;&c_i;&c_z;&c_m;</trd>
  </drv>
</art>
<!--
$Log: empiri1.xml,v $
Revision 1.6  2005/07/27 16:31:40  revo
Jozefo Horvath: +trd hu

Revision 1.5  2003/12/17 17:31:06  revo
Dmitri Gabinski: +trd be

Revision 1.4  2001/04/11 16:21:09  revo
Yury Finkel: +trd ru

-->
</vortaro>
