<?xml version="1.0"?>
<!DOCTYPE vortaro SYSTEM "../dtd/vokoxml.dtd">

<vortaro>
<art mrk="$Id: silezi.xml,v 1.2 2009/04/27 16:31:08 revo Exp $">
<kap>
<rad>Silezi</rad>/o
</kap>
<drv mrk="silezi.0o">
 <kap><tld/>o</kap>
 <snc>
<uzo tip="fak">GEOG</uzo>
<uzo tip="fak">HIS</uzo>
 <dif>
Meze&ubreve;ropa historia regiono, kiu nuntempe apartenas al 
<ref tip="vid" cel="pol.P0ujo">Polujo</ref> (plejparte), al 
<ref tip="vid" cel="cxehx.CX0ujo">&Ccirc;e&hcirc;ujo</ref> kaj al 
<ref tip="vid" cel="german1.G0ujo">Germanujo</ref>.
 </dif>
<trd lng="de">Schlesien</trd>
<trd lng="en">Silesia</trd>
<trd lng="es">Silesia</trd>
<trd lng="fr">Sil&eacute;sie</trd>
<trd lng="it">Slesia</trd>
<trd lng="lat">Silesia</trd>
 </snc>
</drv>
</art>

<!--
$Log: silezi.xml,v $
Revision 1.2  2009/04/27 16:31:08  revo
Sebastian Cyprych: kor mrk "stl" al "fak"

Revision 1.1  2009/04/17 19:49:45  revo
Antonio Codazzi: nova artikolo

-->
</vortaro>
