<?xml version="1.0"?>
<!DOCTYPE vortaro SYSTEM "../dtd/vokoxml.dtd">

<vortaro>
<art mrk="$Id: degn.xml,v 1.2 2007/07/19 16:31:01 revo Exp $">
<kap>
  <rad>degn</rad>/i <fnt><bib>PIV1</bib></fnt>
</kap>
<drv mrk="degn.0i">
  <kap><tld/>i</kap>
  <gra><vspec>tr</vspec></gra>
  <uzo tip="stl">RAR</uzo>
  <snc mrk="degn.0i.KOMUNE">
    <dif>
      Bonvole komplezi al subulo:
      <ekz>
        vi tion, ver&scirc;ajne, ne <tld/>as kompreni
        <fnt>
        <aut>Fjodor Dostojevskij, trad. A. Kor&jcirc;enkov</aut>,
        <vrk>Noticoj el la kelo</vrk>,
        <bib>LOdE</bib>,
        <lok>2002, numero 7a</lok>
        </fnt>;
      </ekz>
      <ekz>
        nur grandaj sinjoroj scias esti tiom <tld/>aj
        <fnt>
        <bib>Salamandroj</bib>,
        <lok>libro 2a, &ccirc;apitro 1a</lok>
        </fnt>.
      </ekz>
    </dif>
  </snc>
  <trdgrp lng="fr">
    <trd>condescendre</trd>,
    <trd>daigner</trd>
  </trdgrp>
  <trd lng="pt">dignar-se</trd>
</drv>
</art>

<!--
$Log: degn.xml,v $
Revision 1.2  2007/07/19 16:31:01  revo
Tulio Flores: +tr pt

Revision 1.1  2006/08/05 16:31:04  revo
Jeromo Vasxe: nova artikolo

-->
</vortaro>
