<?xml version="1.0"?>
<!DOCTYPE vortaro SYSTEM "../dtd/vokoxml.dtd">

<vortaro>
  <art mrk="$Id: cidar.xml,v 1.8 2009/08/23 16:31:29 revo Exp $">
  <kap>
    <rad>cidar</rad>/o
    <fnt>Z</fnt>
  </kap>
  <drv mrk="cidar.0o">
    <kap><tld/>o</kap>
    <snc num="1">
      <dif>
        Mitro de la juda &ccirc;efpastro. 
      </dif>
      <trd lng="nl">joodse <ind>mijter</ind></trd>
    </snc>
    <snc num="2">
      <dif>
        Turbano de la persaj re&gcirc;oj.  
      </dif>
      <trd lng="nl">kidaris</trd>
    </snc>
    <trd lng="be">&c_t;&c_y;&c_ja;&c_r;&c_a;</trd>
    <trd lng="de">Kidaris</trd>
    <trd lng="hu">tiara<klr tip="ind"> (perzsa, zsid&oacute;)</klr></trd>
    <trd lng="ru">&c_t;&c_i;&c_a;&c_r;&c_a;</trd>
  </drv>
</art>
<!--
$Log: cidar.xml,v $
Revision 1.8  2009/08/23 16:31:29  revo
Paul Peeraerts: +trd nl - kor en hu

Revision 1.7  2004/04/24 19:18:41  revo
Dmitri Gabinski: +trd be

Revision 1.6  2002/12/08 17:31:37  revo
Dennis Wibrow: +trd germ

Revision 1.5  2002/09/23 16:33:07  revo
Jozefo Horvath: +trd hu

Revision 1.4  2000/09/29 16:11:43  revo
Yury Finkel: +rusa trd

-->
</vortaro>
