<?xml version="1.0"?>
<!DOCTYPE vortaro SYSTEM "../dtd/vokoxml.dtd">

<vortaro>
<art mrk="$Id: minstrel.xml,v 1.1 2009/02/10 14:18:55 revo Exp $">
<kap>
  <rad>minstrel</rad>/o
</kap>
<drv mrk="minstrel.0o">
  <kap><tld/>o</kap>
  <snc mrk="minstrel.0o.HIS">
    <uzo tip="fak">BELE</uzo>
    <uzo tip="fak">HIS</uzo>
    <uzo tip="fak">POE</uzo>
    <fnt><bib>PIV2</bib></fnt>
    
    <ref tip="dif" cel="menestre.0o.HIS">menestrelo</ref>
    
    <trd lng="pl">minstrel</trd>
  </snc>
</drv>
</art>

<!--
$Log: minstrel.xml,v $
Revision 1.1  2009/02/10 14:18:55  revo
Sebastian Cyprych: nova artikolo

-->
</vortaro>