<?xml version="1.0"?>
<!DOCTYPE vortaro SYSTEM "../dtd/vokoxml.dtd">
 
<vortaro>
<art mrk="$Id: korego1.xml,v 1.4 2009/07/01 17:22:26 revo Exp $">
<kap><rad>koregoned</rad>/oj</kap>
<drv mrk="korego1.0oj">
  <kap><tld/>oj</kap>
  <uzo tip="fak">ZOO</uzo>
  <snc>
    <dif>
      Familio el la ordo <ref tip="super"
      cel="salm.0oformaj">salmoformaj
      fi&scirc;oj</ref> (<trd lng="la">Coregonidae</trd>).
    </dif>
  </snc>
  <trd lng="de">Renken</trd>
  <trd lng="hu">mar&eacute;naf&eacute;l&eacute;k</trd>
  <trd lng="nl">houtingachtigen</trd>
  <trd lng="pt">Coregonidae</trd>
</drv>
</art>

<!--
$Log: korego1.xml,v $
Revision 1.4  2009/07/01 17:22:26  revo
Paul Peeraerts: +trd nl

Revision 1.3  2006/11/15 17:30:44  revo
Tulio Flores: +tr pt

Revision 1.2  2002/07/04 19:11:40  revo
Jozefo Horvath: +trd hu

-->
</vortaro>
