<?xml version="1.0"?>
<!DOCTYPE vortaro SYSTEM "../dtd/vokoxml.dtd">

<vortaro>
<art mrk="$Id: amendament.xml,v 1.1 2004/03/26 17:31:21 revo Exp $">
<kap>
  <rad>amendament</rad>/o <fnt><bib>PV</bib></fnt>
</kap>
<drv mrk="amendament.0o">
  <kap><tld/>o</kap>
  <uzo tip="stl">ARK</uzo>
  <snc mrk="amendament.0o.JUR">
    <uzo tip="fak">JUR</uzo>
    <ref tip="dif" cel="amend.0o.JUR">amendo</ref>
  </snc>
</drv>
</art>

<!--
$Log: amendament.xml,v $
Revision 1.1  2004/03/26 17:31:21  revo
Jeromo Vasxe: nova artikolo

-->
</vortaro>