<?xml version="1.0"?>
<!DOCTYPE vortaro SYSTEM "../dtd/vokoxml.dtd">

<vortaro>
<art mrk="$Id: frenolog.xml,v 1.2 2007/06/13 16:31:49 revo Exp $">
<kap>
  <rad>frenolog</rad>/o <fnt><bib>PIV1</bib></fnt>
</kap>
<drv mrk="frenolog.0o">
  <kap><tld/>o</kap>
  <snc mrk="frenolog.0o.frenologiisto">
    <ref tip="dif" cel="frenol.0isto.SCI">frenologiisto</ref>
    <ekz>
      tuberoj de lia kranio <klr>...</klr> mirigus <tld/>ojn per stranga
      kombino
      <fnt><bib>Mary</bib></fnt>.
    </ekz>
  </snc>
  <trd lng="fr">phr&eacute;nologue</trd>
  <trdgrp lng="pt">
    <trd>frenolista</trd>,
    <trd>fren&#243;logo</trd>
  </trdgrp>
</drv>
</art>

<!--
$Log: frenolog.xml,v $
Revision 1.2  2007/06/13 16:31:49  revo
Tulio Flores: +tr pt

Revision 1.1  2006/01/19 17:31:39  revo
Jeromo Vasxe: nova artikolo

-->
</vortaro>
