<?xml version="1.0"?>
<!DOCTYPE vortaro SYSTEM "../dtd/vokoxml.dtd">

<vortaro>
<art mrk="$Id: digxit.xml,v 1.3 2007/07/28 16:30:27 revo Exp $">
<kap>
  <rad>di&gcirc;it</rad>/a <fnt><bib>NeoGlo</bib></fnt>
</kap>
<drv mrk="digxit.0a">
  <kap><tld/>a</kap>
  <uzo tip="fak">TEK</uzo>
  <uzo tip="stl">EVI</uzo>
  <ref tip="dif" cel="cifer.0eca">Cifereca</ref>
</drv>
  <trd lng="pt">digital</trd>
</art>
<!--
$Log: digxit.xml,v $
Revision 1.3  2007/07/28 16:30:27  revo
Tulio Flores: +tr pt

Revision 1.2  2006/01/25 17:31:36  revo
Jeromo Vasxe: + fnt

Revision 1.1 2002/10/13 16:31:36 revo
Sergio Pokrovskij: nova artikolo

-->
</vortaro>

