<?xml version="1.0"?>
<!DOCTYPE vortaro SYSTEM "../dtd/vokoxml.dtd">

<vortaro>
<art mrk="$Id: ksilograf.xml,v 1.1 2007/03/16 17:30:25 revo Exp $">
<kap>
  <rad>ksilograf</rad>/o <fnt><bib>PIV1</bib></fnt>
</kap>
<drv mrk="ksilograf.0o">
  <kap><tld/>o</kap>
  <snc mrk="ksilograf.0o.TIP">
    <ref tip="dif" cel="ksilog1.0isto.TIP">ksilografiisto</ref>
    <ekz>
      <ctl><tld/>o Chen Qi kaj liaj verkoj</ctl>
      <fnt>
        <aut>Peng De</aut>,
        <vrk><url ref="http://www.chinareport.com.cn/15p/15p-4.htm">
        Ksilografo Chen Qi...</url></vrk>,
        <lok>2002-06</lok>
      </fnt>.
    </ekz>
  </snc>
  <trd lng="fr">xylographe</trd>
  <trdgrp lng="it">
    <trd>silografo</trd>,
    <trd>xilografo</trd>
  </trdgrp>
</drv>
</art>

<!--
$Log: ksilograf.xml,v $
Revision 1.1  2007/03/16 17:30:25  revo
Jeromo Vasxe: nova artikolo

-->
</vortaro>