<?xml version="1.0"?>
<!DOCTYPE vortaro SYSTEM "../dtd/vokoxml.dtd">
<vortaro>
<art mrk="$Id: anur.xml,v 1.1 2005/02/14 18:20:47 revo Exp $">
<kap>
<rad>anur</rad>/oj
</kap>
<drv mrk="anur.0oj">
<kap><tld/>oj</kap>
<uzo tip="fak">ZOO</uzo>
<snc>
<dif>
<ref tip="dif" cel="vost.sen0uloj">Senvostuloj</ref>.
</dif>
</snc>
</drv>
</art>
<!--
$Log: anur.xml,v $
Revision 1.1  2005/02/14 18:20:47  revo
Dmitri Gabinski: nova artikolo

Revision 1.5  2002/06/29 17:47:49  revo
Jozefo Horvath: +trd hu

Revision 1.4  2002/05/18 16:33:59  revo
Ulrich Fellmann: + 3 trd de  + scienclatina

-->
</vortaro>