<?xml version="1.0"?>
<!DOCTYPE vortaro SYSTEM "../dtd/vokoxml.dtd">

<vortaro>
  <art mrk="$Id: sinekdok.xml,v 1.2 2004/04/14 16:31:34 revo Exp $">
    <kap><rad>sinekdok</rad>/o</kap>

    <drv mrk="sinekdok.0o">
      <kap><tld/>o</kap>
      <uzo tip="fak">LIN</uzo>
      <ref tip="dif" cel="sinekdohx.0o">Sinekdo&hcirc;o</ref>
    </drv>

  </art>

<!--
$Log: sinekdok.xml,v $
Revision 1.2  2004/04/14 16:31:34  revo
Sergio Pokrovskij: -tajperaroj

Revision 1.1  2004/04/13 16:32:15  revo
Sergio Pokrovskij: nova artikolo

-->
</vortaro>
